"x801402538150993920","x1116232684248997889",2019-04-11 06:53:05,"rosemhook","@seanhannity @Jim_Jordan @LindseyGrahamSC @SaraCarterDC Authorized surveillance by a FISA warrant signed by the Deputy AG. AG Barr knows this &amp; showed his cards that he’s protecting Trump at all costs, acting as Trump’s personal AG, rather than his responsibility to act as the AG of the USA. #ReleaseTheReport https://t.co/RQJwCwvciN","Twitter for iPhone",282,"x1116120101156204550","x41634520","seanhannity",TRUE,FALSE,0,0,"ReleaseTheReport",,"twitter.com/deadlinewh/sta…","https://t.co/RQJwCwvciN","https://twitter.com/deadlinewh/status/1116088022611701760?s=21",,,,,,,,,"x41634520 x18166778 x432895323 x25202268","seanhannity Jim_Jordan LindseyGrahamSC SaraCarterDC","en","x1116088022611701760","“It was a shame, I think, today to see Bill Barr – one of our nation’s most respected lawyers, a two-time Attorney General – turn in his tortoise shell glasses for a tinfoil hat.” - @RonaldKlain w/ @NicolleDWallace https://t.co/BF14WWUkuV",2019-04-10 21:18:15,"Wildmoka",6094,2017,"x860123351154556928","DeadlineWH","Deadline White House",130086,177,4989,"New York, NY","Official Twitter account for @MSNBC's #DeadlineWH with @NicolleDWallace 4pm EST",TRUE,,,,,,,,,,,,,,,,,,,,,,"NA NA","NA NA","NA NA NA NA NA NA NA NA","https://twitter.com/rosemhook/status/1116232684248997889","Watchdog4Democracy","United States of America","Co-founder Org4Change #ReproRights #StayWoke #ReSister #PerSister #CivilRights #1stAmendment #OnwardTogether #AntiAuthoritarian #TW #marchingonward #FBR",,FALSE,3444,3413,34,44536,108058,2016-11-23 12:30:29,FALSE,,,"en","https://pbs.twimg.com/profile_banners/801402538150993920/1479910537",,"http://pbs.twimg.com/profile_images/1047054091187359744/3OFuS3vw_normal.jpg"
"x19192602","x1116232683330265088",2019-04-11 06:53:04,"ValarieDennis","“I frankly don’t even recognize the guy anymore.  I am outraged that he would do that, to law enforcement and to the criminal justice system of the USA.” @CynthiaAlksne on Barr saying, with no evidence, that he thinks spying occurred on the Trump campaign. https://t.co/RAAZgLjNQ0","Twitter for iPhone",140,,,,FALSE,TRUE,0,5,,,,,,,,,,,,,,"x205864193","hardball","en",,,,,,,,,,,,,,,,"x1116231417187524609","“I frankly don’t even recognize the guy anymore.  I am outraged that he would do that, to law enforcement and to the criminal justice system of the USA.” @CynthiaAlksne on Barr saying, with no evidence, that he thinks spying occurred on the Trump campaign. https://t.co/RAAZgLjNQ0",2019-04-11 06:48:03,"SocialFlow",13,5,"x205864193","hardball","Hardball",426833,710,50153,"Washington, D.C.","Hardball with Chris Matthews is hosted by @HardballChris. Like us on Facebook and follow us on Instagram. Join the conversation with #Hardball.",TRUE,,,,,,,"NA NA","NA NA","NA NA NA NA NA NA NA NA","https://twitter.com/ValarieDennis/status/1116232683330265088","Valarie Dennis","Orange County","Later in life runner with a love for all things Disney! #runninggrandma #RunDisney #Disneyland #turtlepower",,FALSE,465,524,18,17945,48756,2009-01-19 17:40:22,FALSE,,,"en","https://pbs.twimg.com/profile_banners/19192602/1439058087","http://abs.twimg.com/images/themes/theme5/bg.gif","http://pbs.twimg.com/profile_images/630081401128226816/d6iMumad_normal.jpg"
"x702031418654765056","x1116232682722082816",2019-04-11 06:53:04,"dexterchinn","@Waldo1968 @Hypatia_2nd @Weinsteinlaw @davidhogg111 But trump lost the popular vote by a massive 3 million to a very universally unpopular candidate Clinton lol that and the Electoral college. You also lost the house in droves.","Follower Plus ",140,,,,FALSE,TRUE,0,7,,,,,,,,,,,,,,"x33717882 x140624709 x17901613 x22879254 x1915033663","PossessedXx Waldo1968 Hypatia_2nd Weinsteinlaw davidhogg111","en",,,,,,,,,,,,,,,,"x1115888570420670471","@Waldo1968 @Hypatia_2nd @Weinsteinlaw @davidhogg111 But trump lost the popular vote by a massive 3 million to a very universally unpopular candidate Clinton lol that and the Electoral college. You also lost the house in droves.",2019-04-10 08:05:42,"Twitter for Android",0,7,"x33717882","PossessedXx","Possessed",100,486,967,"","wooT",FALSE,,,,,,,"NA NA","NA NA","NA NA NA NA NA NA NA NA","https://twitter.com/dexterchinn/status/1116232682722082816","Dexter✨","Malaysia","","https://t.co/Z27ti2nboh",FALSE,410,60,35,6666,3855,2016-02-23 07:25:08,FALSE,"https://t.co/Z27ti2nboh","http://Instagram.com/dexterchinn","en","https://pbs.twimg.com/profile_banners/702031418654765056/1516939647",,"http://pbs.twimg.com/profile_images/939721575128956928/9HunW1TK_normal.jpg"
"x67948257","x1116232682357178370",2019-04-11 06:53:04,"DerekSolorsano","@realDonaldTrump Thats just an ILLUSION of good faith to the people as well as CHUMP CHANGE for the money your making running your businesses as president #ExposingthefakePOTUS 

https://t.co/a8O6iV8Lgp","Twitter Web App",185,"x1107771030385426432","x25073877","realDonaldTrump",FALSE,FALSE,0,0,"ExposingthefakePOTUS",,"cheatsheet.com/money-career/a…","https://t.co/a8O6iV8Lgp","https://www.cheatsheet.com/money-career/all-the-ways-trump-cashes-in-on-the-u-s-presidency.html/",,,,,,,,,"x25073877","realDonaldTrump","en",,,,,,,,,,,,,,,,,,,,,,,,,,,,,,,,,,,,,"NA NA","NA NA","NA NA NA NA NA NA NA NA","https://twitter.com/DerekSolorsano/status/1116232682357178370","Derek Solorsano","","Actor/producer/writer/artist/martial artist/father/lover/god believer
 - Give me a follow #ExposingthefakePOTUS","http://t.co/yeosj01H5x",FALSE,41,120,2,304,98,2009-08-22 18:20:24,FALSE,"http://t.co/yeosj01H5x","http://www.imdb.com/name/nm3998145/","en","https://pbs.twimg.com/profile_banners/67948257/1424637737","http://abs.twimg.com/images/themes/theme1/bg.png","http://pbs.twimg.com/profile_images/1101966849347006465/KqHVplIt_normal.jpg"
"x821264158670917632","x1116232681833074688",2019-04-11 06:53:04,"okunijonathan2","Barr believes ""there was spying"" on the Trump campaign during the 2016 election https://t.co/Me5vM5gzMP https://t.co/h7mWZBDc1t","Twitter Web Client",140,,,,FALSE,TRUE,0,947,,,"cbsn.ws/2VBDqPM","https://t.co/Me5vM5gzMP","https://cbsn.ws/2VBDqPM","http://pbs.twimg.com/amplify_video_thumb/1115992118135336965/img/bsjD_QVWDfx9o_Rk.jpg","https://t.co/h7mWZBDc1t","https://twitter.com/CBSNews/status/1115992165841346560/video/1","photo","http://pbs.twimg.com/amplify_video_thumb/1115992118135336965/img/bsjD_QVWDfx9o_Rk.jpg","https://t.co/h7mWZBDc1t","https://twitter.com/CBSNews/status/1115992165841346560/video/1",,"x15012486","CBSNews","en",,,,,,,,,,,,,,,,"x1115992165841346560","Barr believes ""there was spying"" on the Trump campaign during the 2016 election https://t.co/Me5vM5gzMP https://t.co/h7mWZBDc1t",2019-04-10 14:57:21,"SnapStream TV Search",4455,947,"x15012486","CBSNews","CBS News",6692165,439,209776,"New York, NY","Your source for original reporting and trusted news.",TRUE,,,,,,,"NA NA","NA NA","NA NA NA NA NA NA NA NA","https://twitter.com/okunijonathan2/status/1116232681833074688","okunijonathan","","",,FALSE,35,817,0,1606,2393,2017-01-17 07:53:28,FALSE,,,"en",,,"http://abs.twimg.com/sticky/default_profile_images/default_profile_normal.png"
"x79268352","x1116232681572974593",2019-04-11 06:53:04,"mjfallon","“I've got to say, he has a point.... Really, who remembers George Washington, am I right?” asks @andersoncooper, on a report that President Trump criticized George Washington for not naming Mount Vernon after himself. #TheRidiculist https://t.co/ieplw3SKVs","Twitter for iPhone",140,,,,FALSE,TRUE,0,225,,,,,,,,,,,,,,"x227837742 x15224867","AC360 andersoncooper","en",,,,,,,,,,,,,,,,"x1116151813898686469","“I've got to say, he has a point.... Really, who remembers George Washington, am I right?” asks @andersoncooper, on a report that President Trump criticized George Washington for not naming Mount Vernon after himself. #TheRidiculist https://t.co/ieplw3SKVs",2019-04-11 01:31:44,"SnapStream TV Search",891,225,"x227837742","AC360","Anderson Cooper 360°",1285280,158,65885,"New York, NY","A behind the scenes look at Anderson Cooper 360°. Watch AC360° M-F at 8pm/ET on @CNN and follow Anderson on twitter: @AndersonCooper.",TRUE,,,,,,,"NA NA","NA NA","NA NA NA NA NA NA NA NA","https://twitter.com/mjfallon/status/1116232681572974593","Maurice Fallon","Dublin City, Ireland","Dream the dreams of other men and you'll be no one's rival...",,FALSE,550,2039,5,2798,33536,2009-10-02 19:38:53,FALSE,,,"en","https://pbs.twimg.com/profile_banners/79268352/1432493087","http://abs.twimg.com/images/themes/theme1/bg.png","http://pbs.twimg.com/profile_images/1030411946909155329/7wlPI-cH_normal.jpg"
"x1083090391786696704","x1116232681442828288",2019-04-11 06:53:04,"s_klarity","They’re scared... https://t.co/ycLrDfpbEv","Twitter Web Client",61,,,,FALSE,TRUE,0,9867,,,"foxnews.com/politics/dems-…","https://t.co/ycLrDfpbEv","https://www.foxnews.com/politics/dems-rage-against-barr-for-backing-claims-of-trump-campaign-spying-by-fbi",,,,,,,,,"x78523300","RealJamesWoods","en",,,,,,,,,,,,,,,,"x1116118238021033984","They’re scared... https://t.co/ycLrDfpbEv",2019-04-10 23:18:19,"Twitter for iPhone",30333,9867,"x78523300","RealJamesWoods","James Woods",2102582,5305,28377,"","Verified account for James Woods. I have no other Twitter account, no Facebook account, nor any “Gab” account. Those are all phony accounts impersonating me.",TRUE,,,,,,,"NA NA","NA NA","NA NA NA NA NA NA NA NA","https://twitter.com/s_klarity/status/1116232681442828288","Kenya's Klarity","Colorado","💯% Follow Back ⛱️ RT's don't always= endorsements. ❌Banned but back❌ I am a human resource, not to be confused with an HR dept.🎀💝
✝","https://t.co/N8j5HYWIzD",FALSE,1998,2108,0,665,1729,2019-01-09 19:57:27,FALSE,"https://t.co/N8j5HYWIzD","https://kenyasklarity.site123.me/","en","https://pbs.twimg.com/profile_banners/1083090391786696704/1553043479","http://abs.twimg.com/images/themes/theme1/bg.png","http://pbs.twimg.com/profile_images/1083092155403366400/uOlJRLkB_normal.jpg"
"x1084536571787907073","x1116232681262592001",2019-04-11 06:53:04,"Anyhow91498521","@SpeakerPelosi SUBPOENA him Nancy.....it's the only way through. It's going to be messy but there is no other way. The longer this goes on more damage is done and a increased chance Trump will take 2020!!!!!!","Twitter for Android",193,"x1116121934327054336","x15764644","SpeakerPelosi",FALSE,FALSE,0,0,,,,,,,,,,,,,,"x15764644","SpeakerPelosi","en",,,,,,,,,,,,,,,,,,,,,,,,,,,,,,,,,,,,,"NA NA","NA NA","NA NA NA NA NA NA NA NA","https://twitter.com/Anyhow91498521/status/1116232681262592001","Agent Orange 🇷🇺 🇸🇦","","Lover of fact and truth",,FALSE,41,81,0,1245,2352,2019-01-13 19:44:03,FALSE,,,"en","https://pbs.twimg.com/profile_banners/1084536571787907073/1549573205",,"http://pbs.twimg.com/profile_images/1093615403140558848/-4ZXpDVm_normal.jpg"
"x15591784","x1116232680893497344",2019-04-11 06:53:04,"jazzisnana1","And so it begins. 

https://t.co/ThFqrJQSY8
@POTUS #Indictments.","Twitter for Android",83,,,,FALSE,TRUE,0,376,"Indictments",,"breaking911.com/breaking-forme…","https://t.co/ThFqrJQSY8","https://breaking911.com/breaking-former-obama-white-house-counsel-to-be-indicted/",,,,,,,,,"x940430173517811714 x822215679726100480","intheMatrixxx POTUS","en",,,,,,,,,,,,,,,,"x1116161827904348160","And so it begins. 

https://t.co/ThFqrJQSY8
@POTUS #Indictments.",2019-04-11 02:11:31,"Twitter for iPhone",844,376,"x940430173517811714","intheMatrixxx","[intheMatrixxx]",90625,28639,20722,"Nebuchadnezzar","What you know you can't explain, but you feel it. You've felt it your entire life, that there's something wrong with the world. You don't know what it is...",FALSE,,,,,,,"NA NA","NA NA","NA NA NA NA NA NA NA NA","https://twitter.com/jazzisnana1/status/1116232680893497344","Lesa","Maine, USA","Mom & Nana Christian Patriot",,FALSE,1281,234,3,1792,5801,2008-07-25 00:46:43,FALSE,,,"en","https://pbs.twimg.com/profile_banners/15591784/1550377218","http://abs.twimg.com/images/themes/theme1/bg.png","http://pbs.twimg.com/profile_images/842209286499520512/V9kT4ooO_normal.jpg"
"x1600706508","x1116232679014400000",2019-04-11 06:53:03,"lynn_lckatlvr","@RepAdamSchiff I would ask, “how will Republicans react when a Democratic president does the same,” but then I realize that no Democrat would trample on the constitutional norms like Trump has.","Twitter for iPhone",140,,,,FALSE,TRUE,0,1357,,,,,,,,,,,,,,"x133938408 x29501253","krassenstein RepAdamSchiff","en",,,,,,,,,,,,,,,,"x1115980279334821888","@RepAdamSchiff I would ask, “how will Republicans react when a Democratic president does the same,” but then I realize that no Democrat would trample on the constitutional norms like Trump has.",2019-04-10 14:10:07,"Twitter for iPhone",6272,1357,"x133938408","krassenstein","Brian Krassenstein",675988,611520,54903,"Fort Myers, FL","Getting you through the Donald Trump fiasco. Editor at https://t.co/GrHQUy3bo8 -- Podcast - https://t.co/MF5hkN7KJX --Follow My Brother: @EdKrassen",FALSE,,,,,,,"NA NA","NA NA","NA NA NA NA NA NA NA NA","https://twitter.com/lynn_lckatlvr/status/1116232679014400000","Lynn Collier","Oklahoma, USA","",,FALSE,158,662,0,4288,4420,2013-07-17 11:20:54,FALSE,,,"en",,"http://abs.twimg.com/images/themes/theme1/bg.png","http://abs.twimg.com/sticky/default_profile_images/default_profile_normal.png"
"x104309271","x1116232678947217408",2019-04-11 06:53:03,"bobclendenin","@trump_deanna @GOPChairwoman I must have missed something- you just posted a video of a distraught Muslim woman. How does that relate to Omar?","Twitter for iPad",113,"x1116228502423056384","x901533225339715584","trump_deanna",FALSE,FALSE,0,0,,,,,,,,,,,,,,"x901533225339715584 x2353605901","trump_deanna GOPChairwoman","en",,,,,,,,,,,,,,,,,,,,,,,,,,,,,,,,,,,,,"NA NA","NA NA","NA NA NA NA NA NA NA NA","https://twitter.com/bobclendenin/status/1116232678947217408","bob clendenin","","I’m an acquired taste. Q = blocked, ❌ = blocked.","https://t.co/KsAnfzDmFS",FALSE,11795,360,204,35718,101945,2010-01-12 23:39:20,TRUE,"https://t.co/KsAnfzDmFS","http://www.imdb.com/name/nm0003928/","en","https://pbs.twimg.com/profile_banners/104309271/1461092474","http://abs.twimg.com/images/themes/theme5/bg.gif","http://pbs.twimg.com/profile_images/1075440587090800640/bZLpXttr_normal.jpg"
"x22228174","x1116232678762864642",2019-04-11 06:53:03,"JimBonz","So now Mnuchin, not the IRS Commissioner, illegally refuses. Lawless’: Treasury Department says it won’t meet Congressional deadline for handing over Trump’s taxes https://t.co/rPQHjIGQoK","Twitter Web Client",140,,,,FALSE,TRUE,0,300,,,,,,,,,,,,,,"x845392971381927936","psychdr100","en",,,,,,,,,,,,,,,,"x1116140999250571265","So now Mnuchin, not the IRS Commissioner, illegally refuses. Lawless’: Treasury Department says it won’t meet Congressional deadline for handing over Trump’s taxes https://t.co/rPQHjIGQoK",2019-04-11 00:48:45,"Twitter Web Client",370,300,"x845392971381927936","psychdr100","Dr. Robert Fortuna",156379,116124,27286,"San Diego, CA","Clinical Psychologist  Activist for environment and Women's rights Animal rights #ReleaseTheFullMuellerReport #Indivisable   #BoycottNRA",FALSE,,,,,,,"NA NA","NA NA","NA NA NA NA NA NA NA NA","https://twitter.com/JimBonz/status/1116232678762864642","James ""Lodestar"" Bonz","bellevue washington","Electronica - Internet Marketing    IT. Linux  SEO ,   🌊 Democrat #MayflowerDescendant   fides et veritas -  aut viam inveniam aut faciam     #resist","https://t.co/A0DZIXMaNo",FALSE,22916,25183,213,211318,83343,2009-02-28 04:28:30,FALSE,"https://t.co/A0DZIXMaNo","https://www.facebook.com/jbonz1","en","https://pbs.twimg.com/profile_banners/22228174/1498794173","http://abs.twimg.com/images/themes/theme9/bg.gif","http://pbs.twimg.com/profile_images/404189201/head_shot_normal.jpg"
"x235717469","x1116232678582439937",2019-04-11 06:53:03,"GrandSchemeMuzk","Here we go. On top of protecting Trump against obstruction of justice, Barr is now starting an investigation into the FBI’s investigation of Trump. As we slide into Authoritarianism, we can never say it wasn’t right there in front of us.","Twitter Web Client",139,,,,FALSE,TRUE,0,13455,,,,,,,,,,,,,,"x738080573365702657","robreiner","en",,,,,,,,,,,,,,,,"x1115809117849829376","Here we go. On top of protecting Trump against obstruction of justice, Barr is now starting an investigation into the FBI’s investigation of Trump. As we slide into Authoritarianism, we can never say it wasn’t right there in front of us.",2019-04-10 02:49:59,"Twitter for iPhone",40108,13455,"x738080573365702657","robreiner","Rob Reiner",627490,290,2492,"California, USA","Filmmaker, actor, producer, husband, and father.",TRUE,,,,,,,"NA NA","NA NA","NA NA NA NA NA NA NA NA","https://twitter.com/GrandSchemeMuzk/status/1116232678582439937","Grand Scheme","RALEIGH, NC","Follow #ROHutch @ROHutch919  | For media inquiries, contact: 📬grandschemepromo93@gmail.com | #TheCity coming soon ☚ #Raleigh #GrandScheme #919 #NC","https://t.co/k8doRUTKEc",FALSE,2432,3276,187,48593,38915,2011-01-08 22:49:38,FALSE,"https://t.co/k8doRUTKEc","http://www.ROHutch.com","en","https://pbs.twimg.com/profile_banners/235717469/1525755021","http://abs.twimg.com/images/themes/theme1/bg.png","http://pbs.twimg.com/profile_images/993714629867196416/k8pK3oyR_normal.jpg"
"x1116229351551512577","x1116232677819023360",2019-04-11 06:53:03,"fesdireta","President Obama’s White House Counsel is expected to be indicted as early as next week.

Boom.","Twitter Web App",113,,,,FALSE,TRUE,0,642,,,,,,,,,,,,,,"x166751745","RyanAFournier","en",,,,,,,,,,,,,,,,"x1116206610924343296","President Obama’s White House Counsel is expected to be indicted as early as next week.

Boom.",2019-04-11 05:09:28,"Twitter for iPhone",2122,642,"x166751745","RyanAFournier","Ryan Fournier",653742,397807,9555,"Washington, DC & Raleigh, NC","Political Commentator and Analyst - Chairman of @TrumpStudents - President of @XStrategiesDC - RF@xstrats.com",TRUE,,,,,,,"NA NA","NA NA","NA NA NA NA NA NA NA NA","https://twitter.com/fesdireta/status/1116232677819023360","fesdireta","","mklhiumunhjqcis",,FALSE,0,5,0,4,1,2019-04-11 06:39:50,FALSE,,,"en",,,"http://pbs.twimg.com/profile_images/1116229426793066497/xsHSnY4c_normal.jpg"
"x2585019206","x1116232676804055040",2019-04-11 06:53:03,"LittleNiangua","The Department of Justice — for the first time since the founding of our Country — gives the green light to foreign government payoffs despite the very clear language in the Constitution.
Pathetic.

https://t.co/Aa1Vnk7qZH","Twitter for iPhone",139,,,,FALSE,TRUE,0,1058,,,,,,,,,,,,,,"x2863996955","RWPUSA","en",,,,,,,,,,,,,,,,"x1116157560892080128","The Department of Justice — for the first time since the founding of our Country — gives the green light to foreign government payoffs despite the very clear language in the Constitution.
Pathetic.

https://t.co/Aa1Vnk7qZH",2019-04-11 01:54:34,"Twitter Web App",1476,1058,"x2863996955","RWPUSA","Richard W. Painter",586244,183,13025,"Mendota Heights MN","Law Professor, University of Minnesota; former chief White House ethics lawyer 2005-07; Independent. Views expressed here are my own.",FALSE,,,,,,,"NA NA","NA NA","NA NA NA NA NA NA NA NA","https://twitter.com/LittleNiangua/status/1116232676804055040","Little Niangua","","#DutyToWarn #Resist #KeepFamiliesTogether #BLM #IBelieveTheWomen #NoWall 🌊🇺🇸❄️",,FALSE,718,1057,3,18634,10967,2014-06-24 03:29:09,FALSE,,,"en","https://pbs.twimg.com/profile_banners/2585019206/1541879847","http://abs.twimg.com/images/themes/theme1/bg.png","http://pbs.twimg.com/profile_images/1089391986875006976/btdG2TqI_normal.jpg"
"x3267492132","x1116232676640354305",2019-04-11 06:53:03,"MarioGa38197297","Steve Mnuchin ignores the law requiring IRS to turn over Trump’s #TaxReturns &amp; falsely claims: ""The general public when they elected [Trump] made the decision to elect him without his tax returns being released.""

Trump LOST the popular vote by 3 million‼️
https://t.co/UecJtUrRF3","Twitter for iPhone",143,,,,FALSE,TRUE,0,2762,"TaxReturns",,,,,,,,,,,,,"x1651522832","DrDenaGrayson","en",,,,,,,,,,,,,,,,"x1116005627581562880","Steve Mnuchin ignores the law requiring IRS to turn over Trump’s #TaxReturns &amp; falsely claims: ""The general public when they elected [Trump] made the decision to elect him without his tax returns being released.""

Trump LOST the popular vote by 3 million‼️
https://t.co/UecJtUrRF3",2019-04-10 15:50:50,"Twitter for iPhone",6240,2762,"x1651522832","DrDenaGrayson","Dr. Dena Grayson",150485,326,57221,"Florida","Patriotic liberal. Former Democratic candidate for U.S. Congress, physician (MD) and scientist (PhD). ""Brain dead moron"" per Trump trolls.",TRUE,,,,,,,"NA NA","NA NA","NA NA NA NA NA NA NA NA","https://twitter.com/MarioGa38197297/status/1116232676640354305","MG","Point on a map","AZ raised, resident of TX. Combat Veteran. Champion of Human Rights.. ASU Alum. Faith in Humanity. I travel over a thousand miles a week.",,FALSE,337,461,0,1501,22643,2015-07-04 00:30:54,FALSE,,,"en","https://pbs.twimg.com/profile_banners/3267492132/1539605980","http://abs.twimg.com/images/themes/theme1/bg.png","http://pbs.twimg.com/profile_images/1095557365485785094/35cwA383_normal.jpg"
"x48780338","x1116232676371861504",2019-04-11 06:53:03,"aquaricorn","Idea: Trump is ignoring all the other candidates and desperately attacking Bernie Sanders &amp; Medicare for All because Trump knows how strong a Democratic nominee Bernie would be, and Trump knows how a Medicare for All-themed campaign would defeat Trump’s re-election bid. https://t.co/DHxvypXakB","Twitter for Android",144,,,,FALSE,TRUE,0,217,,,,,,,,,,,,,,"x14855994","davidsirota","en",,,,,,,,,,,,,,,,"x1116139646163927041","Idea: Trump is ignoring all the other candidates and desperately attacking Bernie Sanders &amp; Medicare for All because Trump knows how strong a Democratic nominee Bernie would be, and Trump knows how a Medicare for All-themed campaign would defeat Trump’s re-election bid. https://t.co/DHxvypXakB",2019-04-11 00:43:23,"Twitter for iPad",676,217,"x14855994","davidsirota","David Sirota",130246,2698,376,"The 1980s","Now: @BernieSanders' speechwriter, @TheGoldbergsABC guy, @EmilyforCO spouse. Past: Loeb finalist/SABEW-winning journo at @Newsweek @CapitalandMain @GuardianUS",TRUE,,,,,,,"NA NA","NA NA","NA NA NA NA NA NA NA NA","https://twitter.com/aquaricorn/status/1116232676371861504","Praag, like da city :)","","Hindu atheist humanist (ie. super secular & pro science). Indian & Canadian. Both dearly love and hate my favourite hockey team. So yes, I'm complicated.",,FALSE,92,587,2,10691,21251,2009-06-19 18:11:23,FALSE,,,"en",,"http://abs.twimg.com/images/themes/theme1/bg.png","http://pbs.twimg.com/profile_images/1045466663569821696/pvY5s1YB_normal.jpg"
"x4886716857","x1116232676187496448",2019-04-11 06:53:03,"rowhom","@tomselliott lol, when Obama did it, it was good, but when Trump does it , its bad. Typical left hypocrisy at work","Twitter for iPhone",127,,,,FALSE,TRUE,0,2,,,,,,,,,,,,,,"x268657863 x49698174","Seaphre tomselliott","en",,,,,,,,,,,,,,,,"x1115963588802486272","@tomselliott lol, when Obama did it, it was good, but when Trump does it , its bad. Typical left hypocrisy at work",2019-04-10 13:03:47,"Twitter Web Client",17,2,"x268657863","Seaphre","Tippy FelzenStein",5207,5680,16526,"California","Thrown into the storms of life, I was forced to swim with dolphins in the deep sea, where treasure of life reveals the light  https://t.co/0klpYMCjLA",FALSE,,,,,,,"NA NA","NA NA","NA NA NA NA NA NA NA NA","https://twitter.com/rowhom/status/1116232676187496448","Susan Hill","","",,FALSE,47,100,1,6557,12570,2016-02-08 04:34:13,FALSE,,,"en",,,"http://abs.twimg.com/sticky/default_profile_images/default_profile_normal.png"
"x1044561225718345728","x1116232674774065152",2019-04-11 06:53:02,"AnjaMarkert","The Friday protests involve schoolchildren and teens and have been inspired by Swedish teen activist Greta Thunberg.
https://t.co/MlEsrix6Zi","Twitter Web App",140,,,,FALSE,TRUE,0,246,,,,,,,,,,,,,,"x240649814","TimesNow","en",,,,,,,,,,,,,,,,"x1114737058898173952","The Friday protests involve schoolchildren and teens and have been inspired by Swedish teen activist Greta Thunberg.
https://t.co/MlEsrix6Zi",2019-04-07 03:50:00,"TweetDeck",1084,246,"x240649814","TimesNow","TIMES NOW",8858638,375,372394,"India","TIMES NOW is India’s most watched English news channel. Follow us for breaking news & updates.",TRUE,,,,,,,"NA NA","NA NA","NA NA NA NA NA NA NA NA","https://twitter.com/AnjaMarkert/status/1116232674774065152","Animals for future","Kleve, Niederrhein, Germany","Climate 1st!    🌝🌙💫🌎
Nature and animals 2nd!   ☘️🍄🌾🌸🦔🦀🐝🐢
Humans tolerated!    🏃‍♀️🚴‍♂️🧘‍♂️
We are unstoppable!
Hambi bleibt!",,FALSE,150,450,1,3544,3913,2018-09-25 12:16:17,FALSE,,,"en","https://pbs.twimg.com/profile_banners/1044561225718345728/1538324504",,"http://pbs.twimg.com/profile_images/1106107410652020736/CZaEE3P1_normal.jpg"
