"x1113546180800208898","x1116232674195247104",2019-04-11 06:53:02,"Elizabe28943541","Trump with some motivational advice for the Mexicans. https://t.co/1MAdB9D9PS","Twitter Web Client",93,,,,FALSE,TRUE,0,1603,,,,,,"http://pbs.twimg.com/ext_tw_video_thumb/1083371078196645888/pu/img/WK6ahFfiYkt46Yyk.jpg","https://t.co/1MAdB9D9PS","https://twitter.com/ianbremmer/status/1083371118088675329/video/1","photo","http://pbs.twimg.com/ext_tw_video_thumb/1083371078196645888/pu/img/WK6ahFfiYkt46Yyk.jpg","https://t.co/1MAdB9D9PS","https://twitter.com/ianbremmer/status/1083371118088675329/video/1",,"x60783724","ianbremmer","en",,,,,,,,,,,,,,,,"x1083371118088675329","Trump with some motivational advice for the Mexicans. https://t.co/1MAdB9D9PS",2019-01-10 14:32:57,"Twitter Web Client",3667,1603,"x60783724","ianbremmer","ian bremmer",423594,1289,37036,"","political scientist, author, prof at nyu, columnist at time, president @eurasiagroup, @gzeromedia. if you lived here, you'd be home now.",TRUE,,,,,,,"NA NA","NA NA","NA NA NA NA NA NA NA NA","https://twitter.com/Elizabe28943541/status/1116232674195247104","Elizabeth Clifford","St Paul, MN","I am here😽 https://t.co/u8GBpUkSjl","https://t.co/u8GBpUkSjl",FALSE,0,39,0,96,86,2019-04-03 20:57:52,FALSE,"https://t.co/u8GBpUkSjl","http://send7nudes.com","en","https://pbs.twimg.com/profile_banners/1113546180800208898/1554499004",,"http://pbs.twimg.com/profile_images/1114275714864492544/QbxX8iJa_normal.jpg"
"x593843865","x1116232673498939392",2019-04-11 06:53:02,"MercifulAngel40","The Wall Street Journal reports that former White House insiders Hope Hicks and Keith Schiller have been talking to federal authorities in New York as part of their campaign-finance probe. https://t.co/Ejyac5Dgw8","Twitter for Android",140,,,,FALSE,TRUE,0,24,,,,,,,,,,,,,,"x2836421","MSNBC","en",,,,,,,,,,,,,,,,"x1116229169363464192","The Wall Street Journal reports that former White House insiders Hope Hicks and Keith Schiller have been talking to federal authorities in New York as part of their campaign-finance probe. https://t.co/Ejyac5Dgw8",2019-04-11 06:39:07,"SocialFlow",59,24,"x2836421","MSNBC","MSNBC",2393659,603,161572,"","The place for in-depth analysis, political commentary and informed perspectives.",TRUE,,,,,,,"NA NA","NA NA","NA NA NA NA NA NA NA NA","https://twitter.com/MercifulAngel40/status/1116232673498939392","Allice #RESIST #MUELLERTIME #WATERISLIFE","#NODAPL #NOKXL #TRUMPRUSSIA","I'm a Christian Independant I fight for equal rights, even if I don't agree w/your choices. I think we should stand up for those who can't stand for themselves",,FALSE,659,1828,25,20801,17916,2012-05-29 14:41:44,FALSE,,,"en","https://pbs.twimg.com/profile_banners/593843865/1529211354","http://abs.twimg.com/images/themes/theme1/bg.png","http://pbs.twimg.com/profile_images/560214233590145024/AnO9-m0k_normal.jpeg"
"x489022138","x1116232672894947329",2019-04-11 06:53:02,"Miki9857","Jay, whose work as a Time Magazine reporter was hard to distinguish from his work on behalf of Dem candidates and the Obama Administration, proves my point. The press will be loath to cover an investigation of the O Admin the same way they relished covering charges vs Trump. https://t.co/HVMkQGvhV1","Twitter Web Client",140,,,,FALSE,TRUE,0,934,,,,,,,,,,,,,,"x35218566","AriFleischer","en",,,,,,,,,,,,,,,,"x1116056504350707713","Jay, whose work as a Time Magazine reporter was hard to distinguish from his work on behalf of Dem candidates and the Obama Administration, proves my point. The press will be loath to cover an investigation of the O Admin the same way they relished covering charges vs Trump. https://t.co/HVMkQGvhV1",2019-04-10 19:13:00,"Twitter Web Client",2793,934,"x35218566","AriFleischer","Ari Fleischer",335637,1400,15816,"","Ex WH Press Secretary. I run a communications co. whose clients are sports organizations, athletes & corporations. Go Yankees/Dolphins. FOX News contributor.",TRUE,,,,,,,"NA NA","NA NA","NA NA NA NA NA NA NA NA","https://twitter.com/Miki9857/status/1116232672894947329","What The Hell ⭐⭐⭐","NY Is a shithole","Daughter of an Army/USAF Vet who served his country during WWII, Korea & Vietnam.  #ClearFlynnNow  #IStandWithGeneralFlynn",,FALSE,10518,10216,159,238630,13839,2012-02-11 03:11:34,FALSE,,,"en","https://pbs.twimg.com/profile_banners/489022138/1544918723","http://abs.twimg.com/images/themes/theme4/bg.gif","http://pbs.twimg.com/profile_images/1109973785795530753/1zQGuAZH_normal.png"
"x706098258335166464","x1116232672706064385",2019-04-11 06:53:02,"Lisamseltzer","Betsy DeVos told a House panel Wednesday that she is ""not familiar"" with affirmative action guidance for schools that the Trump administration rescinded last summer

https://t.co/VEsc9S8Okk","Twitter for iPhone",140,,,,FALSE,TRUE,0,13,,,,,,,,,,,,,,"x9300262","politico","en",,,,,,,,,,,,,,,,"x1116226887892783104","Betsy DeVos told a House panel Wednesday that she is ""not familiar"" with affirmative action guidance for schools that the Trump administration rescinded last summer

https://t.co/VEsc9S8Okk",2019-04-11 06:30:03,"SocialFlow",17,13,"x9300262","politico","POLITICO",3793320,1401,301653,"Washington, D.C.","Nobody knows politics like POLITICO. Got a news tip for us? 
👉 https://t.co/fp9nugJuND",TRUE,,,,,,,"NA NA","NA NA","NA NA NA NA NA NA NA NA","https://twitter.com/Lisamseltzer/status/1116232672706064385","Lisa seltzer","","",,FALSE,268,347,9,32092,50037,2016-03-05 12:45:18,FALSE,,,"en","https://pbs.twimg.com/profile_banners/706098258335166464/1497482157",,"http://pbs.twimg.com/profile_images/875689765785530368/oEqdFVGI_normal.jpg"
"x4751881242","x1116232672190197761",2019-04-11 06:53:02,"OutHouseAtty","Important point to remember here - it isn’t just Cohen’s word versus Trump’s. Prosecutors have interviewed a number of other witnesses in order to bolster Cohen’s claims.   https://t.co/kbnrCe1pCP","Twitter for iPhone",140,,,,FALSE,TRUE,0,1128,,,,,,,,,,,,,,"x93069110","maggieNYT","en",,,,,,,,,,,,,,,,"x1115964919533514752","Important point to remember here - it isn’t just Cohen’s word versus Trump’s. Prosecutors have interviewed a number of other witnesses in order to bolster Cohen’s claims.   https://t.co/kbnrCe1pCP",2019-04-10 13:09:05,"Twitter for iPhone",3517,1128,"x93069110","maggieNYT","Maggie Haberman",1074485,3873,199306,"","White House correspondent for NYTimes, analyst for CNN. RTs don't imply agreement. maggie.haberman@nytimes.com",TRUE,,,,,,,"NA NA","NA NA","NA NA NA NA NA NA NA NA","https://twitter.com/OutHouseAtty/status/1116232672190197761","DIXIE NORMISS","Eastern Tip N’West Peninsula","Never met a stranger I didn’t meet. #Resist #25A",,FALSE,1581,1538,52,82058,80480,2016-01-13 07:07:11,FALSE,,,"en","https://pbs.twimg.com/profile_banners/4751881242/1550210368",,"http://pbs.twimg.com/profile_images/1096284751000887297/SXCkU1EB_normal.jpg"
"x283871018","x1116232672165203968",2019-04-11 06:53:02,"ArielleCalvo","I think anyone who thinks Trump and Bibi can bring about a peace agreement, doesnt know shit about reality. https://t.co/kOJ3YUc9gQ","Twitter for iPhone",107,,,,TRUE,FALSE,0,0,,,"twitter.com/hananyanaftali…","https://t.co/kOJ3YUc9gQ","https://twitter.com/hananyanaftali/status/1116124958831333376",,,,,,,,,,,"en","x1116124958831333376","Trump and Netanyahu are great allies! 🇮🇱🇺🇸

Do you think that the peace plan is good for Israel?
https://t.co/KeTyuKD1Ly #IsraelElections2019",2019-04-10 23:45:01,"Twitter Web Client",149,41,"x619400667","HananyaNaftali","Hananya Naftali",41507,1207,16680,"Israel 🇮🇱","Pro-Israel 🇮🇱 🇺🇸 | IDF reservist | Middle East conflict 🌍 | #HumanRights | Public speaker | #Politics | Not politically correct",FALSE,,,,,,,,,,,,,,,,,,,,,,"NA NA","NA NA","NA NA NA NA NA NA NA NA","https://twitter.com/ArielleCalvo/status/1116232672165203968","Arielle Calvo","Tel Aviv","Opinionated book nerd who swears a lot. Will probably mention I’m Sephardi within 10 minutes.",,FALSE,1622,746,53,27707,4481,2011-04-18 05:26:25,FALSE,,,"en","https://pbs.twimg.com/profile_banners/283871018/1523122410","http://abs.twimg.com/images/themes/theme1/bg.png","http://pbs.twimg.com/profile_images/995258851933990913/utpkag96_normal.jpg"
"x881298410053042176","x1116232672148221954",2019-04-11 06:53:02,"Marie60342053","AG Bill Barr testified today that “spying did occur” on the Trump campaign during the 2016 election… @LindseyGrahamSC, @Jim_Jordan, and @SaraCarterDC will have reaction on #Hannity
https://t.co/MLyYca05qL","Twitter for iPhone",140,,,,FALSE,TRUE,0,2596,,,,,,,,,,,,,,"x41634520 x432895323","seanhannity LindseyGrahamSC","en",,,,,,,,,,,,,,,,"x1116120101156204550","AG Bill Barr testified today that “spying did occur” on the Trump campaign during the 2016 election… @LindseyGrahamSC, @Jim_Jordan, and @SaraCarterDC will have reaction on #Hannity
https://t.co/MLyYca05qL",2019-04-10 23:25:43,"Twitter for iPhone",8474,2596,"x41634520","seanhannity","Sean Hannity",4039484,4,516,"NYC","TV Host Fox News Channel 9 PM EST. Nationally Syndicated Radio Host 3-6 PM EST. https://t.co/z23FRgA02S Retweets, Follows NOT endorsements! Due to hackings, no DM’s!",TRUE,,,,,,,"NA NA","NA NA","NA NA NA NA NA NA NA NA","https://twitter.com/Marie60342053/status/1116232672148221954","Marie","","",,FALSE,126,103,0,13044,21912,2017-07-01 23:48:09,FALSE,,,"en",,,"http://abs.twimg.com/sticky/default_profile_images/default_profile_normal.png"
"x37076920","x1116232671909203968",2019-04-11 06:53:02,"Hecklington","This reckless accusation of treason is ignorant and reprehensible.  However impossible it may be for Trump to disgrace himself at this point, he continues to disgrace—and to illustrate his unfitness for—the presidency by using such ridiculous rhetoric. https://t.co/l3KkCWh8pT","Twitter for iPhone",140,,,,FALSE,TRUE,0,2791,,,,,,,,,,,,,,"x471677441","gtconway3d","en",,,,,,,,,,,,,,,,"x1116177001818275840","This reckless accusation of treason is ignorant and reprehensible.  However impossible it may be for Trump to disgrace himself at this point, he continues to disgrace—and to illustrate his unfitness for—the presidency by using such ridiculous rhetoric. https://t.co/l3KkCWh8pT",2019-04-11 03:11:49,"Twitter for iPhone",10710,2791,"x471677441","gtconway3d","George Conway",495237,934,7191,"Washington, DC and NYC","Lawyer.    Windmill cancer survivor.",FALSE,,,,,,,"NA NA","NA NA","NA NA NA NA NA NA NA NA","https://twitter.com/Hecklington/status/1116232671909203968","Judy Friend","The Valley","I'm a Valley Girl still trying to figure out what I want to be when I grow up.",,FALSE,241,175,5,7391,29415,2009-05-01 23:35:57,FALSE,,,"en","https://pbs.twimg.com/profile_banners/37076920/1360770418","http://abs.twimg.com/images/themes/theme1/bg.png","http://pbs.twimg.com/profile_images/1373171169/Photo195_normal.jpg"
"x60756131","x1116232671905177601",2019-04-11 06:53:02,"SeattleNewsHeds","Seattle (WA) KCPQ: Inslee: Forget impeaching Trump. Voting him out is&amp;nbsp;better.. More #Seattle #news - https://t.co/ph2mVcgVf1","Seattle News Heds",133,,,,FALSE,FALSE,0,0,"Seattle news",,"tinyurl.com/ybody8kq","https://t.co/ph2mVcgVf1","https://tinyurl.com/ybody8kq",,,,,,,,,,,"en",,,,,,,,,,,,,,,,,,,,,,,,,,,,,,,,,,,,,"NA NA","NA NA","NA NA NA NA NA NA NA NA","https://twitter.com/SeattleNewsHeds/status/1116232671905177601","1stHeadlines Seattle","USA","Latest news headlines about Seattle, Washington","https://t.co/4OAhwa9ZkO",FALSE,1421,0,123,152234,0,2009-07-28 00:20:35,FALSE,"https://t.co/4OAhwa9ZkO","http://www.1stheadlines.com/seattlewa.htm","en",,"http://abs.twimg.com/images/themes/theme1/bg.png","http://pbs.twimg.com/profile_images/338659564/1sttwt-Seattle_normal.gif"
"x1050310157664686081","x1116232670537756672",2019-04-11 06:53:01,"Nowyous45796118","Oh man! When Obama finds out the Obama administration was spying he’s gonna be mad.","Twitter for iPhone",101,,,,FALSE,TRUE,0,1184,,,,,,,,,,,,,,"x821511862881845248","sean_spicier","en",,,,,,,,,,,,,,,,"x1116010346832125952","Oh man! When Obama finds out the Obama administration was spying he’s gonna be mad.",2019-04-10 16:09:35,"Twitter for iPhone",4326,1184,"x821511862881845248","sean_spicier","Sean Spicier",118401,1939,5719,"Moscow","I'm not him but @YahooStyle @UnivisionNews @BillKristol @WashTimes @HuffPost @JonahNRO @kurteichenwald @Toure & think I am",FALSE,,,,,,,"NA NA","NA NA","NA NA NA NA NA NA NA NA","https://twitter.com/Nowyous45796118/status/1116232670537756672","Nowyouseeme","","",,FALSE,72,130,0,11126,11185,2018-10-11 09:00:30,FALSE,,,"en",,,"http://abs.twimg.com/sticky/default_profile_images/default_profile_normal.png"
"x1050310157664686081","x1116232668549713921",2019-04-11 06:53:01,"Nowyous45796118","They’re scared... https://t.co/ycLrDfpbEv","Twitter for iPhone",61,,,,FALSE,TRUE,0,9867,,,"foxnews.com/politics/dems-…","https://t.co/ycLrDfpbEv","https://www.foxnews.com/politics/dems-rage-against-barr-for-backing-claims-of-trump-campaign-spying-by-fbi",,,,,,,,,"x78523300","RealJamesWoods","en",,,,,,,,,,,,,,,,"x1116118238021033984","They’re scared... https://t.co/ycLrDfpbEv",2019-04-10 23:18:19,"Twitter for iPhone",30333,9867,"x78523300","RealJamesWoods","James Woods",2102582,5305,28377,"","Verified account for James Woods. I have no other Twitter account, no Facebook account, nor any “Gab” account. Those are all phony accounts impersonating me.",TRUE,,,,,,,"NA NA","NA NA","NA NA NA NA NA NA NA NA","https://twitter.com/Nowyous45796118/status/1116232668549713921","Nowyouseeme","","",,FALSE,72,130,0,11126,11185,2018-10-11 09:00:30,FALSE,,,"en",,,"http://abs.twimg.com/sticky/default_profile_images/default_profile_normal.png"
"x1081615407042252800","x1116232669900283904",2019-04-11 06:53:01,"politicea","To clarify: Barr has no evidence of improprieties in the FBI investigation, including “spying,” but wants to examine the matter anyway because he has ""concerns"" and because, as he said, he believes spying did occur (even if he hasn’t seen evidence of it) https://t.co/yguyRtauD3","Twitter for iPhone",140,,,,FALSE,TRUE,0,4417,,,,,,,,,,,,,,"x20742461","TimOBrien","en",,,,,,,,,,,,,,,,"x1116053963642671104","To clarify: Barr has no evidence of improprieties in the FBI investigation, including “spying,” but wants to examine the matter anyway because he has ""concerns"" and because, as he said, he believes spying did occur (even if he hasn’t seen evidence of it) https://t.co/yguyRtauD3",2019-04-10 19:02:54,"Twitter Web Client",10764,4417,"x20742461","TimOBrien","Tim O'Brien",107228,999,40256,"New York","Executive Editor: Bloomberg Opinion (@bopinion). NBC/MSNBC analyst. Priors: New York Times, Wall Street Journal, HP. Author: ""TrumpNation""",TRUE,,,,,,,"NA NA","NA NA","NA NA NA NA NA NA NA NA","https://twitter.com/politicea/status/1116232669900283904","amateur political theorist","","this is where i’ll be posting hot takes & generally speaking my mind :)",,FALSE,10,318,0,529,564,2019-01-05 18:16:23,FALSE,,,"en","https://pbs.twimg.com/profile_banners/1081615407042252800/1546712700",,"http://pbs.twimg.com/profile_images/1082256918318665728/8Bf1foJa_normal.jpg"
"x573277220","x1116232669862301696",2019-04-11 06:53:01,"MichaelBarger1","By the way: The spying on the Trump campaign was not ‘unauthorized surveillance.’ We know the Obama Administration authorized it. The whole point of the Barr investigation is to determine why","Twitter Web Client",140,,,,FALSE,TRUE,0,227,,,,,,,,,,,,,,"x592730371","JackPosobiec","en",,,,,,,,,,,,,,,,"x1116195960953212928","By the way: The spying on the Trump campaign was not ‘unauthorized surveillance.’ We know the Obama Administration authorized it. The whole point of the Barr investigation is to determine why",2019-04-11 04:27:09,"Twitter for iPhone",617,227,"x592730371","JackPosobiec","Jack Posobiec 🇺🇸",454020,997,76727,"Washington, DC","@OANN Host. Catholic. DIA/ONI. National security conservative. Veteran. Bio: https://t.co/FX4CjHv1uU",TRUE,,,,,,,"NA NA","NA NA","NA NA NA NA NA NA NA NA","https://twitter.com/MichaelBarger1/status/1116232669862301696","Michael Barger","San Francisco","Internet Cristero warrior. Byzantine Catholic former Jesuit.  #WalkAway activist. Soldier in Kyle Brennan's Army. His murder will be avenged.","https://t.co/VPlJBj7M9t",FALSE,2993,4912,344,407636,29300,2012-05-07 04:00:01,FALSE,"https://t.co/VPlJBj7M9t","https://vbreton2062.wordpress.com/","en","https://pbs.twimg.com/profile_banners/573277220/1352559691","http://abs.twimg.com/images/themes/theme1/bg.png","http://pbs.twimg.com/profile_images/429645390078431232/Y9iYBGMj_normal.jpeg"
"x16052537","x1116232668721631232",2019-04-11 06:53:01,"jcrutcher","SEN @ChrisVanHollen: You concluded Trump didn't obstruct justice. Do you agree with Mueller that the 'evidence presents difficult issues of law and fact'?

BARR: I'm not commenting on the Mueller report

VAN HOLLEN: But *you* exonerated Trump, not Mueller!

BARR: ¯\_(ツ)_/¯ https://t.co/DoldoHnccE","Twitter for iPhone",140,,,,FALSE,TRUE,0,606,,,,,,,,,,,,,,"x288277167 x18137749","atrupar ChrisVanHollen","en",,,,,,,,,,,,,,,,"x1115999486235615234","SEN @ChrisVanHollen: You concluded Trump didn't obstruct justice. Do you agree with Mueller that the 'evidence presents difficult issues of law and fact'?

BARR: I'm not commenting on the Mueller report

VAN HOLLEN: But *you* exonerated Trump, not Mueller!

BARR: ¯\_(ツ)_/¯ https://t.co/DoldoHnccE",2019-04-10 15:26:26,"Twitter Web Client",1177,606,"x288277167","atrupar","Aaron Rupar",95711,999,57481,"","journalist @voxdotcom",TRUE,,,,,,,"NA NA","NA NA","NA NA NA NA NA NA NA NA","https://twitter.com/jcrutcher/status/1116232668721631232","jcrutcher","London, England","Husband, father, friend, reader, dog walker.",,FALSE,114,60,6,9410,6649,2008-08-30 07:34:02,FALSE,,,"en","https://pbs.twimg.com/profile_banners/16052537/1497728941","http://abs.twimg.com/images/themes/theme1/bg.png","http://pbs.twimg.com/profile_images/850259522060812288/jj-xQyrV_normal.jpg"
"x832381085979987972","x1116232667996016640",2019-04-11 06:53:01,"restorit2","Nuts. #CrazyStupidNuts. #LockHimUp.-----Donald Trump doesn’t even know what planet he’s on https://t.co/Gen8cts6jm via @PalmerReport","Twitter for iPhone",140,,,,FALSE,TRUE,0,1,"CrazyStupidNuts LockHimUp",,"palmerreport.com/analysis/what-…","https://t.co/Gen8cts6jm","https://www.palmerreport.com/analysis/what-planet-hes-on-trump-donald/17276",,,,,,,,,"x491196570","KarenChestney","en",,,,,,,,,,,,,,,,"x1116218425615867904","Nuts. #CrazyStupidNuts. #LockHimUp.-----Donald Trump doesn’t even know what planet he’s on https://t.co/Gen8cts6jm via @PalmerReport",2019-04-11 05:56:25,"Twitter Web Client",0,1,"x491196570","KarenChestney","Karen Chestney",7301,7972,220282,"Small Island Pacific Northwest","Retire Phlebotomy / health care. USNbrat. #Education #EqualRights 4 All #SUPPORTVETS/K-9,COFFEE,Science, ,Environment, #Resistance #UnionStrong .#UnitedBlue 🌲🌊",FALSE,,,,,,,"NA NA","NA NA","NA NA NA NA NA NA NA NA","https://twitter.com/restorit2/status/1116232667996016640","Ray","Florida, USA","I am a little crazy but not stupid ! Atheist!#resistance,#FBR,#resist, DM open! trumpanzies will be blocked ! End this shit show! oh I steal good gifs! thanks!",,FALSE,3946,4545,8,88221,15424,2017-02-17 00:08:10,FALSE,,,"en","https://pbs.twimg.com/profile_banners/832381085979987972/1553462376",,"http://pbs.twimg.com/profile_images/1070953687420411905/CmDT8eZj_normal.jpg"
"x957897798858440704","x1116232667329175553",2019-04-11 06:53:01,"Jag18131400","@inittowinit007 @realDonaldTrump @FLOTUS @POTUS @RealJamesWoods @DonaldJTrumpJr @MaladjustedCre1 @realtalkbtr @TrumpsAlways @GemMar333 @SassyT_Joy @CCM1956 @buzzman888 @PhilMcCrackin44 Trump became President to oust the corruption from our government.
Democrats &amp; Rinos have fought him at every turn to stop him from revealing their treasonous crimes. Friday night the tide turned. 
The President is vindicated! The democrats are doomed. Let the 
indictments begin! https://t.co/NuUsF9O3RB","Twitter for Android",140,,,,FALSE,TRUE,0,38,,,,,,,,,,,,,,"x748711844286726145 x4918885219 x25073877 x818876014390603776 x822215679726100480 x78523300 x39344374 x1090416332263182337 x26889385 x822927813347069953","PamB60 inittowinit007 realDonaldTrump FLOTUS POTUS RealJamesWoods DonaldJTrumpJr MaladjustedCre1 realtalkbtr TrumpsAlways","en",,,,,,,,,,,,,,,,"x1109847722767642624","@inittowinit007 @realDonaldTrump @FLOTUS @POTUS @RealJamesWoods @DonaldJTrumpJr @MaladjustedCre1 @realtalkbtr @TrumpsAlways @GemMar333 @SassyT_Joy @CCM1956 @buzzman888 @PhilMcCrackin44 Trump became President to oust the corruption from our government.
Democrats &amp; Rinos have fought him at every turn to stop him from revealing their treasonous crimes. Friday night the tide turned. 
The President is vindicated! The democrats are doomed. Let the 
indictments begin! https://t.co/NuUsF9O3RB",2019-03-24 16:01:31,"Twitter Web Client",39,38,"x748711844286726145","PamB60","💥Patriot🇺🇸Pam💥",39051,36395,79205,"United States of America","FB @GenFlynn @LarrySchweikart 
@PoliticalShort @Scaramucci  @StephenBaldwin7 @RitaCosby @DineshDSouza @OliverMcGee @PastorDScott @DebbieAAldrich @JessieJaneDuff",FALSE,,,,,,,"NA NA","NA NA","NA NA NA NA NA NA NA NA","https://twitter.com/Jag18131400/status/1116232667329175553","Jag - BETRAYEDBYTHETORIES","Farfaraway","Love Floyd, Skynyrd, Eagles, Jags & other cats, Brexit,Trump, free speech. No time for FBPE dopes, liberals, commies, SNP, PC pricks. One of the 52% + the 55%.",,FALSE,1116,1847,1,22114,15373,2018-01-29 08:46:46,FALSE,,,"en",,,"http://pbs.twimg.com/profile_images/961284225604440066/vwjM5Pfh_normal.jpg"
"x1737851893","x1116232666909741059",2019-04-11 06:53:01,"mdmurray1207","Seems clear to me, Mueller quit digging when all of his tunnels led to Hillary, Obama and Democrats.","Twitter Web Client",115,,,,FALSE,TRUE,0,1370,,,,,,,,,,,,,,"x129235890","Lrihendry","en",,,,,,,,,,,,,,,,"x1116149640024547329","Seems clear to me, Mueller quit digging when all of his tunnels led to Hillary, Obama and Democrats.",2019-04-11 01:23:05,"Twitter for iPhone",3252,1370,"x129235890","Lrihendry","Lori Hendry",271308,6297,299611,"","Here to support PRESIDENT TRUMP, fellow patriots, & my country! •Unapologetic Conservative •Views are my own #AmericaFirst #TRUMP2020 #KAG🇺🇸",FALSE,,,,,,,"NA NA","NA NA","NA NA NA NA NA NA NA NA","https://twitter.com/mdmurray1207/status/1116232666909741059","#ClearGeneralFlynn-A digital soldier","","",,FALSE,3449,4029,0,14475,30925,2013-09-06 22:17:24,FALSE,,,"en-gb",,"http://abs.twimg.com/images/themes/theme1/bg.png","http://abs.twimg.com/sticky/default_profile_images/default_profile_normal.png"
"x41118513","x1116232666880380928",2019-04-11 06:53:01,"jbaird02","A Trump supporter sent pipe bombs to prominent Democrats six months ago in a politically motivated assassination attempt. https://t.co/xEalTri1RE","Twitter Web App",140,,,,FALSE,TRUE,0,858,,,,,,,,,,,,,,"x130496027","jonfavs","en",,,,,,,,,,,,,,,,"x1116192948864126976","A Trump supporter sent pipe bombs to prominent Democrats six months ago in a politically motivated assassination attempt. https://t.co/xEalTri1RE",2019-04-11 04:15:11,"Twitter for iPhone",3263,858,"x130496027","jonfavs","Jon Favreau",1152907,1422,28835,"Los Angeles, CA","I used to write speeches now I host pods. Check out my new documentary on the history and future of the Democratic Party: https://t.co/5vu4M6gpB3",TRUE,,,,,,,"NA NA","NA NA","NA NA NA NA NA NA NA NA","https://twitter.com/jbaird02/status/1116232666880380928","awesome opposum","austin, texas","i'm a short and feisty texan who wont forget her west virginia roots. im a lady when i deem it necessary and a tom boy the rest of the time.",,FALSE,310,1039,20,40397,83151,2009-05-19 13:49:49,FALSE,,,"en","https://pbs.twimg.com/profile_banners/41118513/1364682809","http://abs.twimg.com/images/themes/theme1/bg.png","http://pbs.twimg.com/profile_images/913025576390283264/tNa7y-qU_normal.jpg"
"x939018163","x1116232666544787456",2019-04-11 06:53:00,"john_afloat","So we have a choice to make. Stay and help shape and reform the EU in collaboration and partnership with 27 fellow states. Or strike out into the cold dark unknown of Brexit in a time of Trump, a surging China, and ever increasing international cooperation.","Twitter for iPhone",140,,,,FALSE,TRUE,0,3,,,,,,,,,,,,,,"x45010849","uk_domain_names","en",,,,,,,,,,,,,,,,"x1116229007413006340","So we have a choice to make. Stay and help shape and reform the EU in collaboration and partnership with 27 fellow states. Or strike out into the cold dark unknown of Brexit in a time of Trump, a surging China, and ever increasing international cooperation.",2019-04-11 06:38:28,"Twitter for iPhone",9,3,"x45010849","uk_domain_names","Edwin Hayward🦄🏹🗡️",19002,420,37279,"Cambridge, UK","Involved in domain name industry since 1996. Writing a book about driverless cars. Ready to welcome our friendly robot overlords on Singularity day. 48%er.",FALSE,,,,,,,"NA NA","NA NA","NA NA NA NA NA NA NA NA","https://twitter.com/john_afloat/status/1116232666544787456","John Foot","Menorca/East Lothian","Involved in the maintenance of a small boat.",,FALSE,115,679,1,24355,11136,2012-11-10 13:03:06,FALSE,,,"en","https://pbs.twimg.com/profile_banners/939018163/1451403302","http://abs.twimg.com/images/themes/theme1/bg.png","http://pbs.twimg.com/profile_images/980405878758281217/jEbjqdiG_normal.jpg"
