"x770472084","x1116232699394576389",2019-04-11 06:53:08,"martiecee","The US Government made this anti-fascism film in 1943. 

Prophetic in the era of Trump.

🇺🇸

#Resistance #Resist #1u #WednesdayWisdom https://t.co/oEdQgFmIhI","Twitter for Android",140,,,,FALSE,TRUE,0,1036,"Resistance Resist 1u",,,,,,,,,,,,,"x302881437","Marc_Perrone","en",,,,,,,,,,,,,,,,"x1115972632178876419","The US Government made this anti-fascism film in 1943. 

Prophetic in the era of Trump.

🇺🇸

#Resistance #Resist #1u #WednesdayWisdom https://t.co/oEdQgFmIhI",2019-04-10 13:39:43,"Twitter for iPhone",1233,1036,"x302881437","Marc_Perrone","Marc Perrone",172164,161180,6011,"All Over","President of 1.3 million member United Food & Commercial Workers International Union @UFCW. Progressive Motorcycle Rider #Texas #1u #Resist #UnionStrong @AFLCIO",FALSE,,,,,,,"NA NA","NA NA","NA NA NA NA NA NA NA NA","https://twitter.com/martiecee/status/1116232699394576389","Martine","Earth","Please someone stop Trump from separating children from their parents AGAIN! GIVE to @RAICESTEXAS , @ACLU , or any organization that helps immigrants!",,FALSE,121,206,0,4027,17665,2012-08-21 00:09:23,FALSE,,,"en","https://pbs.twimg.com/profile_banners/770472084/1554775643","http://abs.twimg.com/images/themes/theme6/bg.gif","http://pbs.twimg.com/profile_images/1066162053864464389/-28ml5U0_normal.jpg"
"x16028985","x1116232697368600576",2019-04-11 06:53:08,"mmmMeggie","BREAKING: The ACA full repeal that Trump is pushing will be heard the second week of July in the Fifth Circuit.

It is a deeply conservative circuit. Theg should throw this frivolous attack on Americans’ health care out.","Twitter for iPad",140,,,,FALSE,TRUE,0,397,,,,,,,,,,,,,,"x1383272101","ASlavitt","en",,,,,,,,,,,,,,,,"x1116072263567044608","BREAKING: The ACA full repeal that Trump is pushing will be heard the second week of July in the Fifth Circuit.

It is a deeply conservative circuit. Theg should throw this frivolous attack on Americans’ health care out.",2019-04-10 20:15:37,"Twitter for iPad",771,397,"x1383272101","ASlavitt","Andy Slavitt",224732,766,25192,"Edina, MN and Washington, DC","Former head of Medicare, Medicaid & ACA for Obama. Founded @usofcare & @townhallvntrs to make health care work for everyone.",TRUE,,,,,,,"NA NA","NA NA","NA NA NA NA NA NA NA NA","https://twitter.com/mmmMeggie/status/1116232697368600576","Meg ~ Onward ~ Act Now On Climate","WA","Paddling Puget Sound Orcas near by. #StopGunViolence #Resist #AlwaysWithHer  #Inslee #Harris #Warren #Klobuchar #Swalwell",,FALSE,4614,4803,83,46202,22097,2008-08-28 16:28:36,FALSE,,,"en","https://pbs.twimg.com/profile_banners/16028985/1457902533","http://abs.twimg.com/images/themes/theme1/bg.png","http://pbs.twimg.com/profile_images/782356564157960192/egIEGGXN_normal.jpg"
"x331711161","x1116232696664031232",2019-04-11 06:53:08,"__SlumKing__","Teanna Trump got over 300 bodies &amp; yet I’d still slap her shit raw 🤷🏽‍♂️🤣","Twitter for iPhone",89,,,,FALSE,TRUE,0,323,,,,,,,,,,,,,,"x1546447614","BtkZae","en",,,,,,,,,,,,,,,,"x1115700783939502080","Teanna Trump got over 300 bodies &amp; yet I’d still slap her shit raw 🤷🏽‍♂️🤣",2019-04-09 19:39:30,"Twitter for iPhone",1126,323,"x1546447614","BtkZae","Zae® 🦁+💕+",1662,1481,44640," 860","All praise to the most high ✨ #BlackLivesMatter Drippin Forever 💆🏽‍♂️💧 IG: btk_zae 📸",FALSE,,,,,,,"NA NA","NA NA","NA NA NA NA NA NA NA NA","https://twitter.com/__SlumKing__/status/1116232696664031232","$lumWay Nino💲","919 $","CEO of $lumway Ent.‼️💲pop the locks for my brothers! #LLBD #riplilbro #rippete #LLJR #LLTJ #NG4L #LLN",,FALSE,3462,3365,27,57344,11253,2011-07-08 16:13:15,FALSE,,,"en","https://pbs.twimg.com/profile_banners/331711161/1542451433","http://abs.twimg.com/images/themes/theme1/bg.png","http://pbs.twimg.com/profile_images/1107359622413864960/tODHCg94_normal.jpg"
"x1367761880","x1116232696441843712",2019-04-11 06:53:08,"Dominator_D22","“Trump’s Muslim ban is unAmerican,” Rep. Judy Chu tweeted. She and Sen. Chris Coons just introduced bills to revoke that ban and any similar discrimination in the future. https://t.co/XskTbtAedV","Twitter for Android",140,,,,FALSE,TRUE,0,14,,,,,,,,,,,,,,"x15458694","HuffPostPol","en",,,,,,,,,,,,,,,,"x1116210630397190145","“Trump’s Muslim ban is unAmerican,” Rep. Judy Chu tweeted. She and Sen. Chris Coons just introduced bills to revoke that ban and any similar discrimination in the future. https://t.co/XskTbtAedV",2019-04-11 05:25:27,"SocialFlow",32,14,"x15458694","HuffPostPol","HuffPost Politics",1426084,8901,296426,"Washington, D.C.","The latest political news from HuffPost's politics team.",TRUE,,,,,,,"NA NA","NA NA","NA NA NA NA NA NA NA NA","https://twitter.com/Dominator_D22/status/1116232696441843712","Jenn-Aye!","Shenandoah, Iowa","Secret nerd & psychology enthusiast. I also dabble in politics & the like. Being short means I'm a ninja!",,FALSE,800,1066,0,175779,4822,2013-04-20 18:56:37,FALSE,,,"en","https://pbs.twimg.com/profile_banners/1367761880/1541665178","http://abs.twimg.com/images/themes/theme1/bg.png","http://pbs.twimg.com/profile_images/1060446733010911232/UUa8Y5YR_normal.jpg"
"x1091038700354428929","x1116232695812485120",2019-04-11 06:53:07,"CornCrapper","Today William Barr disgraced himself &amp; American Justice. Trump wanted his Roy Cohen. He got him on steroids. The FBI &amp; the IC were trying to protect us against an attempt to destroy our Democracy. Barr’s claims of spying on Trump are aiding &amp; abetting that destruction. #DisBarr","Twitter for iPhone",148,,,,FALSE,TRUE,0,5238,,,,,,,,,,,,,,"x738080573365702657","robreiner","en",,,,,,,,,,,,,,,,"x1116081449721925632","Today William Barr disgraced himself &amp; American Justice. Trump wanted his Roy Cohen. He got him on steroids. The FBI &amp; the IC were trying to protect us against an attempt to destroy our Democracy. Barr’s claims of spying on Trump are aiding &amp; abetting that destruction. #DisBarr",2019-04-10 20:52:08,"Twitter for iPhone",14311,5238,"x738080573365702657","robreiner","Rob Reiner",627490,290,2492,"California, USA","Filmmaker, actor, producer, husband, and father.",TRUE,,,,,,,"NA NA","NA NA","NA NA NA NA NA NA NA NA","https://twitter.com/CornCrapper/status/1116232695812485120","JimmyCornCrapper","Central Cali","Professional introvert. Non republican. Non christian. Nature & cannabis lover, enlightened atheist.","https://t.co/NzAEouaT56",FALSE,28,82,0,600,147,2019-01-31 18:21:11,FALSE,"https://t.co/NzAEouaT56","http://Nothingtoseehere.fuckoff.edu","en","https://pbs.twimg.com/profile_banners/1091038700354428929/1553544404",,"http://pbs.twimg.com/profile_images/1113466444895768577/__pEc66m_normal.jpg"
"x1027930533475565568","x1116232695632334848",2019-04-11 06:53:07,"SavingMinnesota","First thing Barr should expose is the agency that was handling Joseph Mifsud to try and entrap the campaign. That, as well as exposing both Alexander Downer’s and Stefan Halper’s will implicate a lot of people at the very top of the Obama administration.","Twitter for iPhone",140,,,,FALSE,TRUE,0,713,,,,,,,,,,,,,,"x850507814023942144","GeorgePapa19","en",,,,,,,,,,,,,,,,"x1116182624387485696","First thing Barr should expose is the agency that was handling Joseph Mifsud to try and entrap the campaign. That, as well as exposing both Alexander Downer’s and Stefan Halper’s will implicate a lot of people at the very top of the Obama administration.",2019-04-11 03:34:09,"Twitter for iPhone",1547,713,"x850507814023942144","GeorgePapa19","George Papadopoulos",101904,2538,1160,"","Former advisor to President Trump. University College London grad. Author of Deep State Target. Member Board of Advisors C3 International.",FALSE,,,,,,,"NA NA","NA NA","NA NA NA NA NA NA NA NA","https://twitter.com/SavingMinnesota/status/1116232695632334848","❌The Punisher","United States","❌Saving Minnesota, exposing Corruption, Holding People Accountable❌ Build the Wall❌Bacon 🥓 Beer 🍺 Dogs 🐶👍🇺🇸 Saying things you’ve too afraid to say to libs",,FALSE,2467,2884,3,13096,12042,2018-08-10 14:51:51,FALSE,,,"en","https://pbs.twimg.com/profile_banners/1027930533475565568/1541726566","http://abs.twimg.com/images/themes/theme1/bg.png","http://pbs.twimg.com/profile_images/1072569308922986496/ul79F6L1_normal.jpg"
"x336913049","x1116232693514166272",2019-04-11 06:53:07,"mennekinpis","At roundtable in Texas, President Trump laments that US troops at the border can't get ""a little rough,"" because ""everybody would go crazy ... can’t act like they would normally act -- or like, let’s say, another military from another country would act."" https://t.co/q1TPW24Csa","Twitter Web Client",140,,,,FALSE,TRUE,0,1561,,,,,,,,,,,,,,"x14173315","NBCNews","en",,,,,,,,,,,,,,,,"x1116080366824062976","At roundtable in Texas, President Trump laments that US troops at the border can't get ""a little rough,"" because ""everybody would go crazy ... can’t act like they would normally act -- or like, let’s say, another military from another country would act."" https://t.co/q1TPW24Csa",2019-04-10 20:47:49,"Wildmoka",1662,1561,"x14173315","NBCNews","NBC News",6489014,1767,201390,"New York, NY","The leading source of global news and info for more than 75 years. https://t.co/Hd7rJQeDzP",TRUE,,,,,,,"NA NA","NA NA","NA NA NA NA NA NA NA NA","https://twitter.com/mennekinpis/status/1116232693514166272","Lisa Farnan","New York, USA","Loves animals, supports human rights and environmental protection, liberal Democrat","https://t.co/oYqMN5Rgnx",FALSE,1970,4041,276,155091,8405,2011-07-17 03:56:46,FALSE,"https://t.co/oYqMN5Rgnx","http://www.democraticunderground.com","en",,"http://abs.twimg.com/images/themes/theme4/bg.gif","http://pbs.twimg.com/profile_images/1446394250/Meneken_Furby_normal.jpg"
"x22104619","x1116232693308465152",2019-04-11 06:53:07,"JFuzion","@CreativeArtAPE I don't know wtf happened to the left as a whole, but the direct result of that was Trump and the Alt-Right. That's the sad, honest truth and we all need to wake up and be real with ourselves and heal each other.","Twitter for Android",212,"x1116232129099255809","x1030039598","CreativeArtAPE",FALSE,FALSE,1,0,,,,,,,,,,,,,,"x1030039598","CreativeArtAPE","en",,,,,,,,,,,,,,,,,,,,,,,,,,,,,,,,,,,,,"NA NA","NA NA","NA NA NA NA NA NA NA NA","https://twitter.com/JFuzion/status/1116232693308465152","J'Fuzion™","United States","#Tastemaker #Producer #Remixer #Songwriter // Credits: @BSladeNow @DurandBernarr @OheneSavant #MTV #BET #VH1 and more...   #TeamSuxxess  🇵🇷","https://t.co/HlBUQbTe1g",FALSE,1770,3155,51,47785,3557,2009-02-27 03:59:53,FALSE,"https://t.co/HlBUQbTe1g","http://jfuzion.com","en","https://pbs.twimg.com/profile_banners/22104619/1539784243","http://abs.twimg.com/images/themes/theme14/bg.gif","http://pbs.twimg.com/profile_images/1033459008009433088/A0kRkYDD_normal.jpg"
"x1486146991","x1116232692855648256",2019-04-11 06:53:07,"JujuBinitie","To clarify: Barr has no evidence of improprieties in the FBI investigation, including “spying,” but wants to examine the matter anyway because he has ""concerns"" and because, as he said, he believes spying did occur (even if he hasn’t seen evidence of it) https://t.co/yguyRtauD3","Twitter for iPhone",140,,,,FALSE,TRUE,0,4417,,,,,,,,,,,,,,"x20742461","TimOBrien","en",,,,,,,,,,,,,,,,"x1116053963642671104","To clarify: Barr has no evidence of improprieties in the FBI investigation, including “spying,” but wants to examine the matter anyway because he has ""concerns"" and because, as he said, he believes spying did occur (even if he hasn’t seen evidence of it) https://t.co/yguyRtauD3",2019-04-10 19:02:54,"Twitter Web Client",10764,4417,"x20742461","TimOBrien","Tim O'Brien",107228,999,40256,"New York","Executive Editor: Bloomberg Opinion (@bopinion). NBC/MSNBC analyst. Priors: New York Times, Wall Street Journal, HP. Author: ""TrumpNation""",TRUE,,,,,,,"NA NA","NA NA","NA NA NA NA NA NA NA NA","https://twitter.com/JujuBinitie/status/1116232692855648256","Elizabeth Binitie","","",,FALSE,50,298,0,1888,14589,2013-06-05 21:59:42,FALSE,,,"en",,"http://abs.twimg.com/images/themes/theme1/bg.png","http://abs.twimg.com/sticky/default_profile_images/default_profile_normal.png"
"x181140029","x1116232691265880065",2019-04-11 06:53:06,"lotsofuss","I assume that Barr, like others, realizes that this is the last hurrah; that even if reelected, Trump has killed the GOP and conservatism, and that one last taste of power and sniff of the throne is worth admitting in public that a lifetime of supposed principle was just an act. https://t.co/cPZzfUNQhu","Twitter for iPad",139,,,,FALSE,TRUE,0,789,,,,,,,,,,,,,,"x459872442","RadioFreeTom","en",,,,,,,,,,,,,,,,"x1116159977977253888","I assume that Barr, like others, realizes that this is the last hurrah; that even if reelected, Trump has killed the GOP and conservatism, and that one last taste of power and sniff of the throne is worth admitting in public that a lifetime of supposed principle was just an act. https://t.co/cPZzfUNQhu",2019-04-11 02:04:10,"TweetDeck",2543,789,"x459872442","RadioFreeTom","Tom Nichols",220836,1434,268374,"Newport, RI","Professor, author on Russia, war, nukes, and ""The Death of Expertise."" Noted curmudgeon.  Anti-populist. Ex-GOP. Cat guy. Views solely my own.",TRUE,,,,,,,"NA NA","NA NA","NA NA NA NA NA NA NA NA","https://twitter.com/lotsofuss/status/1116232691265880065","Beki Knott","Citizen of America ","Member Latter Day Saints. Legal researcher. Patriot. NoTrump. Artist. Mother 2 beautiful sons. Conversation tho welcome, is not endorsement. @StandUpRepublic","https://t.co/nMfXQVEhMS",FALSE,4257,3021,17,151160,127377,2010-08-21 11:41:23,FALSE,"https://t.co/nMfXQVEhMS","https://www.standuprepublic.com","en","https://pbs.twimg.com/profile_banners/181140029/1525372704","http://abs.twimg.com/images/themes/theme1/bg.png","http://pbs.twimg.com/profile_images/824801453671735296/QeDR2gOu_normal.jpg"
"x951441107572985856","x1116232691085717509",2019-04-11 06:53:06,"PatsyGa00829408","Trump and his campaign’s illicit contacts with a hostile foreign power, and later efforts to obstruct justice, were not ok. Not by a long shot.

When Mueller’s report is finally released, Americans should pay attention to the evidence in the report, not just its conclusions. https://t.co/xGTeQSAkyY","Twitter for Android",139,,,,FALSE,TRUE,0,5021,,,,,,,,,,,,,,"x29501253","RepAdamSchiff","en",,,,,,,,,,,,,,,,"x1116147477437136896","Trump and his campaign’s illicit contacts with a hostile foreign power, and later efforts to obstruct justice, were not ok. Not by a long shot.

When Mueller’s report is finally released, Americans should pay attention to the evidence in the report, not just its conclusions. https://t.co/xGTeQSAkyY",2019-04-11 01:14:30,"Twitter for iPhone",15233,5021,"x29501253","RepAdamSchiff","Adam Schiff",1295533,776,5036,"Burbank, CA","Representing California's 28th Congressional District. Chairman of the House Intelligence Committee (@HouseIntel).",TRUE,,,,,,,"NA NA","NA NA","NA NA NA NA NA NA NA NA","https://twitter.com/PatsyGa00829408/status/1116232691085717509","Patsy Garner","West Tennessee","A quiet meditator and a nature devotee.",,FALSE,668,1047,3,10132,24322,2018-01-11 13:10:11,FALSE,,,"en","https://pbs.twimg.com/profile_banners/951441107572985856/1517090673",,"http://pbs.twimg.com/profile_images/968384134350548993/y5yBbHF5_normal.jpg"
"x393670491","x1116232690116767744",2019-04-11 06:53:06,"kil0smith","Nobody:
Me: Michelle Obama went to my highschool","Twitter for iPhone",65,,,,FALSE,TRUE,0,36,,,,,,,,,,,,,,"x1021572802053386242","idontkkaree","en",,,,,,,,,,,,,,,,"x1116051769384218625","Nobody:
Me: Michelle Obama went to my highschool",2019-04-10 18:54:11,"Twitter for Android",79,36,"x1021572802053386242","idontkkaree","Special K",91,192,352,"Chicago, IL","I speak Polish and hella shit, I also ain't shit UW-Madison",FALSE,,,,,,,"NA NA","NA NA","NA NA NA NA NA NA NA NA","https://twitter.com/kil0smith/status/1116232690116767744","kilo ⚡️","Chicago, IL","tOSU ‘21 #blacklivesmatter","https://t.co/vYj5T6xcfQ",FALSE,1633,1158,1,121373,12227,2011-10-18 22:03:32,FALSE,"https://t.co/vYj5T6xcfQ","https://www.gofundme.com/helpakilahgettoghana","en","https://pbs.twimg.com/profile_banners/393670491/1545692000","http://abs.twimg.com/images/themes/theme10/bg.gif","http://pbs.twimg.com/profile_images/1104066507439591425/ir_5WrUj_normal.jpg"
"x1363545236","x1116232689869185024",2019-04-11 06:53:06,"Top_Sergeant","At roundtable in Texas, President Trump laments that US troops at the border can't get ""a little rough,"" because ""everybody would go crazy ... can’t act like they would normally act -- or like, let’s say, another military from another country would act."" https://t.co/q1TPW24Csa","Twitter for Android",140,,,,FALSE,TRUE,0,1561,,,,,,,,,,,,,,"x14173315","NBCNews","en",,,,,,,,,,,,,,,,"x1116080366824062976","At roundtable in Texas, President Trump laments that US troops at the border can't get ""a little rough,"" because ""everybody would go crazy ... can’t act like they would normally act -- or like, let’s say, another military from another country would act."" https://t.co/q1TPW24Csa",2019-04-10 20:47:49,"Wildmoka",1662,1561,"x14173315","NBCNews","NBC News",6489014,1767,201390,"New York, NY","The leading source of global news and info for more than 75 years. https://t.co/Hd7rJQeDzP",TRUE,,,,,,,"NA NA","NA NA","NA NA NA NA NA NA NA NA","https://twitter.com/Top_Sergeant/status/1116232689869185024","1st Sergeant (First Shirt)","California and Texas","#MarinesAgainstTrump #Resistance Once A Marine Always A MARINE, Retired ARNG (E8) & USMC, Vietnam combat veteran, retired school superintendent",,FALSE,57495,34114,263,94781,106966,2013-04-19 04:13:40,FALSE,,,"en","https://pbs.twimg.com/profile_banners/1363545236/1534628268","http://abs.twimg.com/images/themes/theme1/bg.png","http://pbs.twimg.com/profile_images/1083608700869238785/Ap8Wt-tz_normal.jpg"
"x473464103","x1116232687914758145",2019-04-11 06:53:06,"General_America","So twitter just removed this video President Trump tweeted.

Would be such a shame if it went viral again...
https://t.co/SPDv6tTHHb","Twitter Web Client",140,,,,FALSE,TRUE,0,11968,,,,,,,,,,,,,,"x862493306382626818","KyleKashuv","en",,,,,,,,,,,,,,,,"x1116033552007729158","So twitter just removed this video President Trump tweeted.

Would be such a shame if it went viral again...
https://t.co/SPDv6tTHHb",2019-04-10 17:41:48,"Twitter for iPhone",16884,11968,"x862493306382626818","KyleKashuv","Kyle Kashuv",292131,793,26802,"Kyle@tpusa.com","School Safety Advocate. Director of High School Outreach @TPUSA. RTs ≠ E. Prageru ‘23.",TRUE,,,,,,,"NA NA","NA NA","NA NA NA NA NA NA NA NA","https://twitter.com/General_America/status/1116232687914758145","General America","Louisiana, USA","#Patriot, #Constitutional #Conservative.
A Right is anything that does not require the consent of another.",,FALSE,5851,6030,1,4745,49725,2012-01-25 00:42:53,FALSE,,,"en","https://pbs.twimg.com/profile_banners/473464103/1523580425","http://abs.twimg.com/images/themes/theme1/bg.png","http://pbs.twimg.com/profile_images/1779209907/DSCN0794_Gabe_normal.jpg"
"x2325703076","x1116232687604371457",2019-04-11 06:53:05,"chelmex","Here’s video of Trump Advisor Stephen Miller in high school screaming he’s “sick and tired of being told to pick up my trash, when we have plenty of janitors who are paid to do it for us.” Would be a shame if it went viral... again. https://t.co/cpoSGAdOGv","Twitter for Android",140,,,,FALSE,TRUE,0,28042,,,,,,,,,,,,,,"x14247236","funder","en",,,,,,,,,,,,,,,,"x1115699446954774532","Here’s video of Trump Advisor Stephen Miller in high school screaming he’s “sick and tired of being told to pick up my trash, when we have plenty of janitors who are paid to do it for us.” Would be a shame if it went viral... again. https://t.co/cpoSGAdOGv",2019-04-09 19:34:11,"Twitter for iPhone",30498,28042,"x14247236","funder","Scott Dworkin",456021,68052,205248,"","Co-Founder/Lead Investigator @TheDemCoalition. Host of #DworkinReport podcast. Proud member of #TheResistance. Helped uncover #TrumpRussia. The #TrumpLeaks guy.",TRUE,,,,,,,"NA NA","NA NA","NA NA NA NA NA NA NA NA","https://twitter.com/chelmex/status/1116232687604371457","Chelmex","Dark Side Of The Moon","I don't have a jingoistic, religious or political agenda, as these are the control mediums the 'System' uses to program our behavior, thoughts & actions",,FALSE,2937,2952,90,70189,35094,2014-02-03 16:16:36,FALSE,,,"en","https://pbs.twimg.com/profile_banners/2325703076/1511037649","http://abs.twimg.com/images/themes/theme15/bg.png","http://pbs.twimg.com/profile_images/1083960682004049920/MsYtdrfa_normal.jpg"
"x1089018169606340609","x1116232687222607872",2019-04-11 06:53:05,"BRADRush12","Every American should thank god we are hopefully going to expose the corruption that infected our government under Obama! https://t.co/8rK9nBX72c","Twitter for iPad",121,,,,TRUE,FALSE,0,0,,,"twitter.com/ryanafournier/…","https://t.co/8rK9nBX72c","https://twitter.com/ryanafournier/status/1116128017947004929",,,,,,,,,,,"en","x1116128017947004929","Thank you, Attorney General Barr for confirming today that the Obama Administration did indeed spy on President Trump’s 2016 Presidential Campaign.

Next step should be a long and drawn out investigation followed by indictments and jail time. 🇺🇸",2019-04-10 23:57:10,"Twitter for iPhone",11783,4130,"x166751745","RyanAFournier","Ryan Fournier",653742,397807,9555,"Washington, DC & Raleigh, NC","Political Commentator and Analyst - Chairman of @TrumpStudents - President of @XStrategiesDC - RF@xstrats.com",TRUE,,,,,,,,,,,,,,,,,,,,,,"NA NA","NA NA","NA NA NA NA NA NA NA NA","https://twitter.com/BRADRush12/status/1116232687222607872","BRAD Rush","","",,FALSE,295,186,1,11359,10395,2019-01-26 04:32:19,FALSE,,,"en",,,"http://pbs.twimg.com/profile_images/1099523754315591680/bsVFy4-8_normal.jpg"
"x1267564375","x1116232686824243201",2019-04-11 06:53:05,"sonokocentral","Funny how Maryanne Trump Barry needs to leave her job to be immune from consequences, and her brother needs to keep his for the same reason https://t.co/k6QhEMHi0b","Twitter for Android",140,,,,FALSE,TRUE,0,1063,,,,,,,,,,,,,,"x14348157","crampell","en",,,,,,,,,,,,,,,,"x1116117300955025410","Funny how Maryanne Trump Barry needs to leave her job to be immune from consequences, and her brother needs to keep his for the same reason https://t.co/k6QhEMHi0b",2019-04-10 23:14:35,"Twitter for iPhone",3146,1063,"x14348157","crampell","Catherine Rampell",146840,1123,53457,"Here and there. Usually NYC.","Syndicated opinion columnist @washingtonpost, political/economic commentator @cnn, special correspondent @newshour. Previously econ reporter/theater critic NYT",TRUE,,,,,,,"NA NA","NA NA","NA NA NA NA NA NA NA NA","https://twitter.com/sonokocentral/status/1116232686824243201","🌊 Karma is coming 🌊","northern hemisphere","awake. aware. all around the world.
(header image: detail of 'Blue Wave' by Inka Essenheigh)",,FALSE,857,1124,4,181112,182417,2013-03-14 17:21:34,FALSE,,,"en","https://pbs.twimg.com/profile_banners/1267564375/1510508298","http://abs.twimg.com/images/themes/theme1/bg.png","http://pbs.twimg.com/profile_images/929765304728768513/j45E1DIo_normal.jpg"
"x49399379","x1116232686278807552",2019-04-11 06:53:05,"scottyj432","The Trump/GOP health care plan after they gut the ACA. https://t.co/dKDqeLsMgw","Twitter for Android",54,,,,TRUE,FALSE,0,0,,,"twitter.com/SeamusBlackley…","https://t.co/dKDqeLsMgw","https://twitter.com/SeamusBlackley/status/1116003751901319169",,,,,,,,,,,"en","x1116003751901319169","The black spot in this image is larger in diameter than our solar system. It weighs more than our galaxy. Its halo is matter literally being ripped apart and accelerated to near light speed as it disappears, forever, into a gravitational prison from which there is no escape. https://t.co/dvCJQD85w1",2019-04-10 15:43:23,"Twitter for iPhone",26400,8712,"x2342613998","SeamusBlackley","Seamus Blackley",12196,2504,11497,"Chipping Bitchford","people say 'you're the father of the xbox!' and i say 'call child protective services!' | recovering particle physicist | frenemy of photons",TRUE,,,,,,,,,,,,,,,,,,,,,,"NA NA","NA NA","NA NA NA NA NA NA NA NA","https://twitter.com/scottyj432/status/1116232686278807552","Scott Wagers","Billings, MT","",,FALSE,96,468,0,4583,1070,2009-06-21 19:16:54,FALSE,,,"en",,"http://abs.twimg.com/images/themes/theme1/bg.png","http://pbs.twimg.com/profile_images/1067129279417217024/Qy1L2pB0_normal.jpg"
"x1116229456606060544","x1116232684764667904",2019-04-11 06:53:05,"clarett70612874","Trump calls his immigration policies “the opposite of cruel”","Twitter Web Client",78,,,,FALSE,TRUE,0,5263,,,,,,,,,,,,,,"x259395895","JohnJHarwood","en",,,,,,,,,,,,,,,,"x1106216388035784706","Trump calls his immigration policies “the opposite of cruel”",2019-03-14 15:31:54,"Twitter for iPhone",2408,5263,"x259395895","JohnJHarwood","John Harwood",272389,1527,113556,"Washington, DC","a Dad who covers Washington, the economy and national politics for CNBC. Find my Speakeasy interviews at https://t.co/1W6sZssXTB",TRUE,,,,,,,"NA NA","NA NA","NA NA NA NA NA NA NA NA","https://twitter.com/clarett70612874/status/1116232684764667904","claretta sanders","","",,FALSE,0,0,0,2,0,2019-04-11 06:40:15,FALSE,,,"en",,,"http://abs.twimg.com/sticky/default_profile_images/default_profile_normal.png"
